{
  "formatVersion": 1,
  "repository": "https://github.com/ekkis/Geo",
  "prefix": "S:G",
  "version": "1.0.0",
  "license": "MIT",
  "readme": "README.md",
  "requires": {
    "ontologyVersion": "8.2.0",
    "codes": [
      "I:P",
      "I:O",
      "S:I:D:T:S"
    ]
  },
  "datasets": [
    {
      "id": "countries",
      "path": "data/countries/index.json",
      "definitionCode": "S:G:CO"
    },
    {
      "id": "states",
      "path": "data/states/index.json",
      "definitionCode": "S:G:SD"
    }
  ],
  "delivery": {
    "mode": "snapshot",
    "entry": "definitions/index.json"
  }
}
